595	不小心用了花呗付款	我不想用花呗，我现在很生气	0
596	为什么我的就不可以借呗	为么我开通不了蚂蚁借呗	1
597	现在蚂蚁借呗怎么只能借***个月，不可以***个月了吗	蚂蚁借呗为什么不能借***期分期了	0
598	退回来的钱能返花呗里的钱吗	钱退回来是不是在花呗上了还是	0
599	蚂蚁借呗借款记录不对	怎么删借呗的记录	0
600	为什么我的借呗不可以先息后本	蚂蚁借呗借的钱可不可以不按期还	0
601	花呗分期购与全额花呗付款后来分期有什么区别	来分期有额度借呗怎么么有	0
602	在哪还花呗款	花呗现在要还钱了，咋办	0
603	花呗逾期改还款时间	花呗逾期还钱会怎样	0
604	花呗被冻结账号怎么办	花呗额度冻结是怎么回事	0
605	要像我这样子还要多久才能申请人到蚂蚁借呗的	蚂蚁借呗借的钱多久到	0
606	卖家这么开通花呗	已开通商家花呗，却不能收款	0
607	花呗的钱画到哪了	花呗消费的钱，如果退掉，钱是退到花呗还是支付宝了	0
608	假如这月我有退款那我花呗应还款金额是不是要把退款金额给去掉	我花呗还款这个月金额怎么不对	0
609	我支付宝已经付了款了，怎么花呗上面还欠***元	我已取消自动付款，花呗怎么自动扣了	0
610	花呗在天猫退款	花呗如向何退款	0
611	还蚂蚁借呗占用***万额度吗	蚂蚁借呗额度变更	0
612	为什么提前还款，蚂蚁借呗不能用了	怎么提前还借呗分期的款	0
613	如何查询借呗什么时候到账	蚂蚁借呗一直显示放款中，什么时候能到账	1
614	花呗充值话费能不能退回来	我用花呗冲的话费能不能退回来	1
615	临时关闭借呗	什么时间关闭的借呗	0
616	蚂蚁借呗不能超过几次	蚂蚁借呗有规定次数吗	1
617	商家支持花呗支付但是支付不了	花呗认证不了，是人脸认证	0
618	花呗收款码收的钱在哪	我二维码还不可以收花呗钱	0
619	我要取消网商贷	网商贷也是阿里巴巴的吗	0
620	蚂蚁花呗，下个月自动扣款，全额扣款，我从我的银行卡里边扣了，怎么怎么设置	为什么我付款用银行卡付的款，可花呗也扣了，我卡里的钱也扣了	0
621	花呗上的钱没动下个月用还嘛	这个月消费的花呗是这个月还钱还是下个月还钱	0
622	花呗交费费，啥时候到账	刷花呗到账时间多久	0
623	蚂蚁借呗怎么需要生份证照片了	蚂蚁借呗没有了 换成了什么	0
624	花呗还款后还逾期	没有还清款后关闭花呗会怎么样	0
625	点我知道了就退出花呗	我想退出花呗，应该怎么退	0
626	我想买手机用花呗分期付款我的额度不够怎么办	额度***分三期购***手机怎么提示花呗额度不够	0
627	花呗活动报名	花呗淘金币活动	0
628	花呗可以在实体店使用	京东可以用不可以用花呗	0
629	哪里可领借呗优惠券	借呗免息哪里获得	0
630	开通信用卡收钱和花呗收钱是弹出您的账户暂不符合开通条件	什么样的账户才能开通信用卡和花呗支付的功能	0
631	借呗还款余额限款	借呗余额还款有限制	1
632	花呗是从何处扣款	花呗还款从账户扣款	0
633	花呗有钱为什么还要用我的卡上的钱	花呗自己扣钱 我的钱有用 能不能还给我	0
634	我还了借呗，怎么还没有额度了	借呗还款了怎么还是用不成	0
635	店铺花呗收钱码怎么打开	帮别人的商家收钱码开通花呗	0
636	花呗分期付款，为什么和实际付款的钱数不一样	我的花呗总数和我算得不一样	0
637	蚂蚁积分影响花呗	花呗账单分期对额度有没有影响	0
638	用花呗买的衣服，没确认收货，先返还款了，为什么等到确认收货之后，还得换一次款	为什么花呗确认收货时会再让输一次密码，是不是要再扣一次费，可当时都付过款了	0
639	我想用花呗买机票	可以用花呗付钱吗	0
640	如何进行 花呗 还款分期	如何花呗分期	1
641	借呗使用的条件是什么	我的借呗不能开通的原因是什么	0
642	为撒借呗没有余额了	花呗怎么没有余额了	0
643	支付宝如何花呗还款	花呗邦我付款了后怎么还	1
644	花呗和银行卡重复扣款	美团重复付款，花呗扣了怎么办	0
645	蚂蚁花呗能不能改还款时间 开工资迟	蚂蚁花呗还款日能不能改	1
646	花呗负会不会有影响	花呗用超了有什么影响吗	1
647	我的花呗还款怎么收手续费	我刚刚花呗用了***什么时候还款	0
648	怎么不可以用花呗	钱怎么没花呗里	0
649	怎么样才能用蚂蚁借呗	怎么才能用上借呗	1
650	蚂蚁借呗额度能不能提升	提升借呗额度，查看进度提醒文件不存在	0
651	银行卡锁了，明天再还花呗行吗	在哪修改花呗用银行卡还款	0
652	花呗哪里订酒店	花呗能否预定酒店	0
653	然后花呗也不能用了	我花呗还有余款没有还清，还清以后能用吗	0
654	花呗分期后提前还款优先还的是分期是吗	怎样提前结清花呗分期账单	0
655	***不可以用花呗吗	我的花呗能用了吗	0
656	花呗还款有逾期吗	明天还花呗，会不会逾期	0
657	怎么开通当面付花呗收款	收款蚂蚁花呗	0
658	昨天我女儿用花呗付款,现在要怎么还	怎么还款，在花呗	1
659	怎么替他人还款借呗	借呗两种还款方式	0
660	你说我能用不用花呗	花呗冻结还能用吗	0
661	我蚂蚁花呗没有逾期为什么说我逾期了	花呗逾期十几块钱没有吧	0
662	怎么花呗还款还不上了	花呗明细和应还对不上	0
663	花呗支持信用还款吗	花呗！都支持哪种还款方式	0
664	以后借呗还能用吗	过年时间借呗也能正常使用吗	0
665	借呗如果逾期一天会有影响吗	我的蚂蚁借呗逾期一天，对我的信用有影响吗	0
666	借呗好久没还	没还完借呗还能审核开通么	0
667	借呗帐单日是什么时候	蚂蚁借呗***号借钱什么时候还	0
668	双十一购物津贴抵扣后要支付的金额可以用花呗分期吗	使用蚂蚁花呗付款的订单 可以同时享受双十一津贴优惠吗	0
669	可以帮我看看我的借呗额度有多少吗	花呗可以借多少笔	0
670	我都已经还款了，怎么退款都退到花呗了，这应该还给我	花呗我已经还一期了。现在牵扯到退货退款。怎么办	0
671	借呗提前还款手续费怎么算	借呗提前还款关闭了	0
672	借呗就是现在的网商贷吗	有了借呗还梦用网商贷吗	0
673	借呗还款多少需要短信验证码	怎么修改花呗短信验证码	0
674	为什么还是不给我花呗	为什么我更新花呗了、怎么不见了	0
675	如何暂停蚂蚁借呗	关机蚂蚁借呗	0
676	蚂蚁花呗最低还款算预期吗	花呗还款我是***号，我在***号还算逾期吗	0
677	花呗，下面显示下个月还***	花呗每个月都能分***期吗	0
678	自己可以还借呗吗	借呗可以***天就还款吗	0
679	双十一 花呗活动 免单金额什么时候到	花呗双十一活动报名时间	0
680	花呗有金额上限吗	花呗一天消费上限	0
681	看看我花呗额度	花呗额度可以超额	0
682	我借呗怎么不能提前还款	我想提前还蚂蚁借呗	0
683	我登录花呗为什么总是显示用支付宝帐户登录	点开说可以登陆支付宝账户使用花呗 我我已经登录了	0
684	为什么花呗订不了酒店了	商店怎么帮订花呗	0
685	借呗最多只能分***期	借呗之前可以分***期还，现在怎么只能分***期了	1
686	蚂蚁借呗安计划还款	蚂蚁借呗公司全称	0
687	蚂蚁借呗是每个月都得还钱吗	借呗借***个月，是***个月以后再还款么	0
688	花呗可以有微信还款吗	花呗可以一点一点还吗	0
689	我在蚂蚁花呗交话费怎么没有到账	我用花呗冲话费为什么没冲到	1
690	花呗还款涨的是什么分	花呗最新到账的***是什么钱	0
691	每期借呗还款日一样吗	借呗选择半年还款可以改一年吗	0
692	借呗和网商贷便宜	借呗和网商货有什么不同	0
693	我经常使用支付宝，为什么还没有借呗额度	逾期已经还清为什么不能使用借呗	0
694	花呗分期了会影响芝麻分吗	花呗被限额度了会不会有什么影响	0
695	蚂蚁花呗临时额度用完了可以分期还款吗	花呗临时额度花了以后可以分期吗	0
696	同一个号码只能用一个花呗吗	一个身份证账号号只能开通一个花呗吗	0
697	系统可以申请强制性降低借呗额度吗	我可以申请***的借呗额度吗	0
698	花呗分期怎么办	使用花呗分期后退货手续费怎么退	0
699	花呗临时额度***，可以分期还嘛	花呗的临时额度用了多久还款？可以分期么	0
700	骑单车押金怎么用不了花呗	花呗为什么不可以骑小黄车了	0
701	借呗免息卷能免多久	有没有***期借呗免息卷	0
702	为什么?_?交电费花呗不支持	为什么有的电费不支持花呗	0
703	怎么看商家支不支持用花呗付款	商家可以花呗付款的，我的花呗余额也有，为什么支付却不支持	0
704	借呗花呗还款可以用余利宝吗	是不是花呗还清才可以使用蚂蚁借呗	0
705	修改花呗绑定的密码，花呗跟支付宝是不同一个密码，号码的	我有两个号码支付宝但是另外一个号码不用了而且忘记密码登不上了为什么我这个号用不了支付宝的花呗	0
706	花呗额度怎么转到现有的账户	我另外一个账号有花呗，怎么转到这个账号开	1
707	付款时找不到花呗分期交易	花呗也可以分期付款吗	0
708	借呗系统多久对账户评估	借呗评估期多长时间	0
709	我只用花呗充值一百元，怎么帐单要还三百多	我要怎么查花呗账单	0
710	怎么可以，蚂蚁花呗抽奖	蚂蚁花呗抽奖在哪里	0
711	花呗分期了怎么 提前还款	怎么提前还花呗分期的钱、】	1
712	我的花呗实际额度	花呗额度始终***	0
713	为什么在淘宝买东西用花呗，东西到了，还要付一笔钱	为什么付款了 是使用花呗付款的	0
714	先封掉我的花呗	我的花呗是不是封了	0
715	蚂蚁借呗还有降额度的吗	借呗额度减少吗	1
716	退款了怎么还在花呗还款里	钱是还了花呗吗	0
717	花呗需要手机验证吗	***的花呗要验证码嘛	0
718	花呗的使用是不是受芝麻信用积分的影响的	换手机号码影响花呗信用积分吗	0
719	尾款能取消花呗分期	我花呗不想分期了咋取消	0
720	蚂蚁借呗总额度自己调整怎么恢复	借呗怎么找不着调低额度	0
721	我的花呗额度是***，为什么***都付不了	我想用花呗支付为什么不可以	1
722	我花呗帐号找不到了怎找	我的花呗怎么找不到	0
723	怎么不使用花呗付款	花呗暂时不能使用是什么意思	0
724	用花呗消费的单子，退的运费险是不是也退到花呗里面了	是用花呗支付的运费险也是会直接退到支付宝里面么	0
725	花呗支付支持农信银行卡不	支持农信银行卡还花呗吗	1
726	口碑收款 花呗最高支持多少	支付宝收款支持花呗吗	0
727	我的花呗已还款很久了，为什么负面记录还还	为什么花呗一直显示有个负面记录，逾期未还款	0
728	花呗分期还款会会影响信用度	双十一停止花呗还款，会影响芝麻信用	0
729	系统几时评估蚂蚁借呗	借呗系统评估在什么时候	0
730	已经用花呗付款，但是没收到货就退款了	我已经把花呗还清了，但我之前用花呗付款买的东西，退款是算到我自己的余额吗	0
731	花呗单笔可以支付多少	花呗单笔消费不能超过多少	0
732	我用花呗买的衣服，我已经寄回去了，但是卖家还没收到还在路上，但是花呗账单已经出账了，这个要怎么办	说是退回到花呗了，但是花呗我有分期，这个月的我还完了	0
733	如何更改花呗上的手机号码	如何更改花呗上的电话号码	1
734	我绑定银行卡丢了，暂时还不了花呗，该怎么处理	我刚才点错了，邀请好友帮还花呗	0
735	花呗额度还有***是什么意思	有了好久花呗了，还有额度	0
736	花呗抽奖奖励	花呗在哪里抽奖	0
737	满足什么条件才可以申请借呗	蚂蚁借呗满足条件	1
738	花呗分期三笔可以提前结清一笔吗	两笔花呗可以分开提前结清吗	0
739	用了花呗额度，找不到如何还款	是不是卡里的钱不够自动转到花呗扣款的	0
740	我第一次用花呗,怎么还款	花呗退还了，怎么还要还	0
741	借呗还款后额度未恢复	为什么我按时还款，但是借呗额度没有恢复	1
742	花呗额度已冻结***元是什么意思	花呗额度为什么还在显示冻结中	0
743	借呗还在放款，不需要放款了怎么取消订单	借呗我现在想取消订单	1
744	信用卡和花呗收款开通暂不符合开通条件什么意思	开通花呗，信用卡二维码不符合条件怎么回事	0
745	我主动开蚂蚁借呗	能帮我开一下借呗	1
746	花呗推迟几天还款的吗	一号用花呗几号还款	0
747	花呗借***元下个月还要还多少钱	花呗借款***.息为万分之***，借款十二个月还款方式每月均等.每月要还多少钱	0
748	花呗还款延迟几天	花呗可以延期一天还？吗	0
749	还款花呗上的金额手机号不对怎么更换	花呗的手机号码怎么更换	0
750	花呗还款可不可以用微信或者话费还	花呗还款可以找别人代还吗	0
751	已开通信用卡、花呗收款客服怎么向我付款	我开通了信用卡和花呗收款，但怎么用不了	0
752	怎么样把借呗的信息删除掉	怎么删除借呗借还款	1
753	花呗解冻时间	再次解冻花呗	0
754	为什么我一直用的是银行卡里钱没用花呗上面钱	花呗支付为什么是从银行卡里扣钱	0
755	花呗分期还要利息吗	花呗没法分期了么	0
756	花呗分期利息吵	花呗分期免手续费还会收利息吗	0
757	花呗还迟了每天多少利息	花呗迟了***天还款利息多少	1
758	逾期已还款很久了，为什么还是无法使用花呗	但是我已经还款了没啥还不能用花呗	0
759	开通花呗信誉积分要多少	花呗多少信用分才能开	1
760	花呗分期后能提前还不	花呗分期可以提前还款一期吗	1
761	线下扫码可以花呗吗	花呗可以存钱不	0
762	蚂蚁借呗还款可以使用两个卡吗	蚂蚁借呗没有可以借钱吗	0
763	是因为我取消了支付宝的授权所以你们取消了我借呗嘛	我把借呗取消授权了	0
764	重新注册可以把花呗转移在新号上吗	同一身份证重新注册的支付宝账号可以开花呗借呗吗	0
765	我使用了花呗怎样冲账	前两天使用了花呗支付	0
766	蚂蚁借呗怎么解冻账户	花呗账户被冻结怎么办	1
767	花呗忘记密码了！怎么办	我的花呗支付宝不知道密码怎么办	1
768	花呗要确认收货了才算是吗	用花呗付款要收货后才算借对吗	1
769	我的借呗什么时候恢复	借呗以前能用现在不能用了什么时候恢复	1
770	我的花呗服务被关闭了是怎么回事	花呗为什么关闭不了	0
771	花呗都用在哪里	花呗都能在哪里购物	1
772	花呗绑定银行卡时怎么系统一直繁忙	我在花呗哪里绑定了银行卡 为什么	0
773	花呗有临时提额度吗	花呗额度有限制吗	0
774	个人可以开通信用卡花呗收钱码吗	花呗信用卡二维码申请	0
775	蚂蚁借呗今天最后一天***号还款，最晚在***号几点之前还款	蚂蚁借呗最晚还款日期	0
776	花呗额度多久判定一次	花呗额度什么时候变一次	0
777	三个月消费了不少也绑定了银行卡怎么还解锁不了花呗	为什么我明明绑定银行卡了，怎么花呗还是没有	0
778	花呗签购单什么意思	我有一单***的是什么花呗	0
779	这个提前还花呗了还可以继续使用吗	花呗分期还款可以提前全部结清吗	0
780	之前有蚂蚁借呗，关掉了之后 怎么开通	自己把蚂蚁借呗关了，怎么再次开通	0
781	花呗分期付款的需要付手续费吗	花呗分期怎么才能免手续费	0
782	花呗逾期后要多久才能使用	花呗几时能再次使用	1
783	支付宝没绑银行卡能用花呗吗	在吗，怎么花呗绑定银行卡绑定不起	0
784	能否帮我把蚂蚁花呗重新开通一下	可以帮我暂时开通花呗一个月吗	0
785	花呗绑定了一个支付宝另一个还能开通吗	这个支付宝的花呗关了后，另一个可以开吗	0
786	借呗还了怎么还显示逾期	蚂蚁借呗逾期***天还款会怎样	0
787	我的花呗怎么不能开通	我什么时候能用蚂蚁借呗	0
788	为什么我已经开通花呗和信用卡，收款为什么他们付不了款	商家服务我的为什么不能开通花呗收款	0
789	借呗没法自动还款了	借呗还款怎么不自动扣能	0
790	我用不了蚂蚁借呗	怎么不能用借呗	1
791	花呗分期本金和手续费是谁付的	花呗分期手续费是多少	0
792	沃尔玛超市能不能使用花呗	我的花呗现在只能在天猫超市用了	0
793	如果用花呗分期，还款期限怎么查询	怎么查看花呗还款信息	0
794	小低于***元的付款用花呗要扣手续费吗	花呗支付扣手续费吗	0
795	怎么点击花呗显示系统繁忙	为什么一打开花呗都是系统繁忙	1
796	滴滴打车出租车花呗可以付钱吗	滴滴打车 用花呗 有价格限制吗	0
797	我原来有***元的花呗，我还了花呗了，可以在提升额度吗？显示让我提升额度，提升后是增加了吗	我的意思，比如花呗做分期，我选***期，***期月还***元这***期每月就还***元	0
798	花呗逾期被冻结要怎么解冻	怎么解除蚂蚁花呗冻结	0
799	蚂蚁借呗最大逾期天数是多少	账户余额最高能还蚂蚁借呗多少	0
800	去年开通小号，不知道没有花呗借呗	我之前在花呗 有让我提额 然后我没去提额	0
801	花呗双***使用攻略	花呗使用详细	0
802	双十一借呗有活动么	借呗活动链接	1
803	旧的手机号码的花呗，能不能绑定到新手机号码下面	我的手机号绑定的是现在这个号但是花呗里面是以前的手机号	0
804	电费花呗怎么没发交	为什么交电费不支持花呗付了	1
805	花呗支付以后，为什么没有获得奖励金	超市使用花呗付款后没有奖励金	1
806	花呗人脸识别去除	花呗支付用人脸支付	0
807	蚂蚁花呗咋个开通不了	条件都满足为什么还开通不了花呗	1
808	花呗分期 单笔提前还	花呗分期的钱怎么提前还	0
809	我口碑为什么不可以花呗收款	签约口碑如何收款花呗	0
810	我临时额度都没有，为什么花呗额度是负的	为什么花呗提升的额度是临时的而不是固定的	0
811	花呗可以向商家付钱	可以扫一扫花呗付款吗	0
812	但花呗用不了	我换了下手机号花呗就用不了	0
813	我的花呗怎么还款	我就是，我花呗我都进不去，我怎么换	0
814	想还借呗，没银行卡，怎么还	蚂蚁借呗放款到银行卡显示没有	0
815	蚂蚁借呗只能分六个月还款	蚂蚁借呗为什么只有一个期数	1
816	为什不能花呗收钱	蚂蚁花呗不能收款	1
817	借呗提现到银行卡算提现额度吗	我今天中午把借呗提现到银行卡显示提现成功了	0
818	我是用花呗支付的，为什么现在还要还款***元	我用的是我卡里面的钱怎么花呗里面还要扣这么多钱	0
819	怎样取出花呗里商家退款	退款去花呗了要怎么样拿出来	1
820	蚂蚁花呗临时额度现在负的	我要蚂蚁花呗提临时额度	0
821	我花呗里有个***不知道是什么	我花呗是什么情况	0
822	我的花呗关了为什么显示还没有	为什么我的花呗显示的是关闭状态	0
823	我的怎么没开通，蚂蚁花呗	我怎么开通不了花呗	0
824	为什么我花呗上面有***的额度，买手机不可以分期	等于说用的花呗全额购买，我按照等额方式还款，花呗里必须跟实物价格同等，才可以分期，是这样吗	0
825	我下个月的花呗可以分期吗	我想知道我得花呗账单可以分期付款吗	0
826	花呗退款后怎么还在账单里	退款后钱会还款花呗吗	0
827	花呗九号还款会影响信用吗	花呗还了最低额度还有转到下月账单会影响信用吗	0
828	为什么我退款了花呗钱没到花呗	我上个月花呗还清了，退款为啥没有到我的余额	0
829	我的蚂蚁借呗可以提高吗	我申请了蚂蚁借呗，怎么提现	0
830	蚂蚁借呗还款方式	我需要开通蚂蚁借呗	0
831	可以提前还花呗分期付款的钱吗	花呗分期以后想提前还款	1
832	花呗分期每个月最低还多少	花呗最多分好多期还	0
833	别人可以偷用我的蚂蚁借呗吗	今天用的蚂蚁借呗	0
834	我这个花呗详细账单在哪里看	我的花呗红包在哪里查看	0
835	蚂蚁花呗注销了可以用另一个号开吗	一个账号关闭花呗，名下的另外一个可以开通吗	1
836	花呗电脑如何提前还款	我想提前先还一部分花呗	0
837	我的花呗除了淘宝能买东西其他地方为什么不能使用	我的花呗在支付宝里怎么用不了了，在淘宝可以用	1
838	花呗商家号收款	商家花呗收款为啥只能收***一下	0
839	我的花呗为什么是空白，满屏没有一个字	为什么app花呗没有界面	0
840	花呗逾期三个月有外访什么意思	花呗逾期冻结什么时候解	0
841	用花呗买的东西在哪里看快递	我在蚂蚁花呗买的快递怎么查	1
842	余额宝存的钱转不进去了，我的蚂蚁借呗怎么还	我余额宝钱转不进去，但是我要还蚂蚁借呗里面的钱	1
843	我都是按时还花呗 可是为什么没有蚂蚁借呗	为什么同一个人其他账号没有花呗借呗	0
844	花呗账单付款超期一天会影响信用吗	花呗逾期了会不会影响银行的信用记录	0
845	另一个账号开通花呗	转移花呗到另一个支付宝	0
846	怎么解除两个手机号码登录花呗	手机解绑支付宝再换个手机号登录花呗还能用吗	0
847	为什么我借呗点击提额后，没有额度了	我开通了蚂蚁借呗，怎么提示是呀，暂无信用额度	0
848	我昨天手机坏了，无法换蚂蚁借呗，没事吧	我今天还借呗还晚了一点，手机坏了没有逾期吧	0
849	花呗免息优惠券，或者积分兑换免息页面在哪里	花呗积分兑换的东西在哪看	1
850	美团为什么不能使用花呗付款	为什么在美团外卖上用不了花呗	0
851	蚂蚁花呗如果逾期一天会不会怎么样	蚂蚁花呗逾期会影响贷款吗	0
852	花呗在哪里找到	花呗在哪，找不到	1
853	我现在就想完全关闭花呗的功能	我的花呗刚关闭，想用另一个账号使用开通话呗，但是另一个账号显示我这个账号还在用，是怎么回事	0
854	我开的淘宝店，没有店面能不能开通花呗收款功能	我网店要花呗，只能用现在的手机号开通的店铺	0
855	花呗能主动申请临时额度吗	花呗的零时额度可以申请为正式的吗	0
856	怎么可以花呗提前还清	花呗电脑还款 怎么操作	0
857	花呗被冻结了，怎么解冻	我的花呗冻结了应该怎么解除	1
858	花呗新用户抽到天猫劵但不知道在哪里	花呗抽了一个天猫券 不知道从哪里再找出来	1
859	推迟花呗还款会怎么样	花呗能不能推迟一天还款	0
860	永久无法使用花呗	我无法用花呗	0
861	借呗里的信用贷	是的，我现在在用的账户用不了借呗，以前开的可以用	0
862	为什么花呗催我还款	赔付为什么还要我还花呗	0
863	借呗还款了额度没有恢复	我借呗，提前全部还款了，为什么还没有恢复额度	0
864	我登录花呗为什么老这样显示	为什么花呗不清帐	0
865	我有花呗额度的账号忘记了怎么办	借呗忘记一天怎么办	0
866	借呗今天到期怎么没扣款	没扣款，怎么还借呗	0
867	开通花呗我不用会有额外费用吗	我开通了花呗，如果我不用，不消费，会不会扣年费	1
868	花呗限制消费额度吗	花呗一天消费有限制额度吗	0
869	支付宝号码换了怎么花呗没有换	支付宝更改了手机号后，花呗消费短信没有了	0
870	有花呗入口，但不能支付，是怎么回事	我是美团券***百多不能用花呗，没选项，但是***多的就能用，为什么	0
871	花呗自动还款的程序	就是这个花呗自动还款	1
872	花呗逾期怎么才可以从新开通花呗	花呗被停了怎么开	0
873	用花呗付款后退货要不要收手续费	用花呗分期要手续费，退款后手续费能退吗	0
874	借呗的钱可以转入余额宝中吗	从余额宝转到花呗的钱怎么看不到	0
875	花呗还款请从我的支付宝账号扣除	花呗自动还款，从哪里扣	0
876	蚂蚁借呗没有信用额度怎么办	开通借呗的信用额度具体指什么	0
877	我的花呗***元红包怎么没了	花呗抽红包	0
878	支付宝收钱码花呗信用卡支付宝	申请花呗信用卡收钱	0
879	帮我查花呗的余额	查询我最近花呗额度的增减	0
880	自己花呗里的钱，用了要还的吗	我刚把这个月的花呗还了，现在还可以在使用花呗吗	0
881	怎么没显示花呗了	怎么没有花呗入口	0
882	我现在开通花呗缺少什么条件	花呗需要什么条件开通呀	0
883	双十一的临时花呗额度是和之前花呗的用法一样吗	领取花呗双***临时额度	0
884	蚂蚁借呗可以找他人代还款吗	借呗可以上个月姐下个月还吗	0
885	我今天花呗还款了	我花呗还款什么弄	0
886	花呗分期手机	花呗分期收银台怎么付款	0
