887	为什么我的借呗还款期限只有***个月	为什么蚂蚁借呗先前还款期限有***期？现在只有***期	1
888	手机淘宝买东西用了花呗怎么来还钱	花呗里面的钱是怎么还的	1
889	没有开通花呗，可在淘宝买东西不知道怎么用，现在怎么还款	我不知道为什么开通了花呗？我想马上还钱，怎么办呀	0
890	现在借呗借钱只能分期六个月吗	蚂蚁借呗 为什么只能六个月了	0
891	为什么显示我的花呗钱已还清	我花呗之前还了款为什么还会要还	0
892	花呗笔笔返现	到店花呗返现怎么算	0
893	花呗抽中奖的在哪查询	花呗支付笔笔抽奖，抽到奖品在哪查看	1
894	借呗分六期能提前还款吗	蚂蚁借呗可以提前几天还款吗	0
895	你帮我开通借呗	我的蚂蚁借呗怎么一直开通不了	0
896	花呗系统繁忙请稍后再试。怎么办	花呗系统繁忙	0
897	花呗账单刚还***为什么可余额只有***多	花呗还完了 为什么还有欠款	0
898	花呗临时额度转成固定额度	转移花呗额度	0
899	花呗都是可以用	里面的花呗什么的都是共用的吗	0
900	蚂蚁借呗怎么不能先息后本	怎么借不到蚂蚁借呗了	0
901	支付宝支付密码和花呗的支付密码一样么	借呗支付密码和支付宝一个吗	0
902	花呗怎么负额度了	花呗的金额度下滑	0
903	这个花呗，每日使用限额有限制，有上限吗	顾客向商家用花呗有限额吗	0
904	花呗怎么支付才不会被限额	这几天花呗为什么总限额支付	0
905	我的花呗的钱退到哪里去了，为什么没有显示	之前花呗我还款的钱，在花呗交易取消后，去哪了	0
906	我的借呗全部还款成功，怎么没有信用额度了	怎么借呗的额度少了	0
907	我问的是 花呗除了淘宝其他所有平台都用不了	为什么我的借呗怎么没有额度了？以前不是有的吗？突然没了	0
908	花呗是什么样的软件	花呗尽情花，是什么意思	0
909	我换了个手机花呗怎么进不去	手机号换了怎么花呗账号还是原来的	0
910	花呗额度负	各个时期花呗的额度	0
911	花呗分期会影响正常额度吗	蚂蚁借呗分期还款对额度有没有影响	0
912	花呗记录删除	这个花呗咋删除也在家我	0
913	花呗还款了为什么显示没有还	我的花呗已经支付了为何还显示未还款	1
914	为什么我的借呗利是万五	芝麻信用分比别人还多，为什么我的借呗日利率比人高	0
915	花呗临时额度每月***号领取	怎么样提升花呗临时额度	0
916	为什么上个月借呗借的下个月就不得	我的，借呗、还了款，为什么借不了了	0
917	蚂蚁借呗和网商贷是同一个么	借呗和网商贷只能开一个嘛	0
918	买手机办理分期 花呗额度不够 差一千 怎么提升临时额度	花呗临时额度怎么调整	0
919	我的花呗的额度是多少	花呗额度一般会有多少	1
920	开通花呗不了不用扫脸吗	花呗可以用别的账号开通不	0
921	借呗为什么不扣支付宝的钱	借呗还款为何不在余额宝里扣钱	0
922	花呗用了临时额度的资金还时也是和额度的时间一样吗	花呗的临时额度到期现在的可用额度会扣掉吗	0
923	我忘记我以前的账号了。要还花呗还不上	以前的账号有花呗但是以前的账号忘记了	0
924	密付可以用花呗付款	密支付可以 有花呗吗	1
925	蚂蚁借呗什么时候回复到可以借***个月	苹果手机蚂蚁借呗可以借一个月吗	0
926	我花呗的总额多少	我下个月花呗最低还款金额是多少	0
927	花呗和借呗都不见了	花呗，还有借呗都用不了了	0
928	我这个月花呗用了，***月再办分期可以吗	我这个月才使用的花呗。可以分期换款嘛	0
929	花呗能充羊城通	羊城通充值可以用花呗吗	1
930	我要取消花呗开通人脸识别	借呗如何取消人脸识别	0
931	帮我转接借呗逾期还款专线	我的借呗只有还款了	0
932	花呗领了临时额度后下个月可以该回来吗	花呗可以领取临时额度嘛	0
933	花呗借款怎样绑定银行卡还款	如何绑定蚂蚁借呗的银行卡	0
934	这个花呗冻结了	我的花呗冻结了怎么能解冻	1
935	借呗还了就可以带出来了吗	借呗可以先还部分嘛	0
936	花呗还款为啥显示不一样	花呗还款为何提示绑定银行卡	0
937	为什么我的账户不能开通花呗和信用卡收款	不能开通信用卡花呗收款	1
938	我的蚂蚁花呗转移下个月还	我这个月的账单要还多少钱给花呗	0
939	花呗还不起怎么办	蚂蚁花呗忘记还款了怎么办	0
940	借呗还款日到可以主动还款吗	借呗的还款日能否修改	0
941	花呗自动还款凭什么要收手续费	花呗自动全额还款还需要手续费吗	0
942	如何主动申请借呗额增加	如何主动申请借呗提高额度	1
943	借呗有没有三天期限	借呗逾期两天逾期怎么办	0
944	绑定银行卡后花呗还是不能用	花呗不能用支付宝还款吗	0
945	退到花呗里的钱该怎么使用	用了怎么还花呗	0
946	我想取消借呗的功能 可以吗	借呗在逾期期间是否是会无法借款 我的逾期一天	0
947	蚂蚁花呗，我已经还了，为什么蚂蚁借呗提示我还有逾期金没有还	借呗页面显示尚有贷款逾期	0
948	我的花呗额度最高额度有多少	蚂蚁花呗的对应额度	0
949	我的蚂蚁借呗怎么借不了钱了	支付宝借呗是不是规则改了	0
950	账户暂不支持开通花呗收款	账户暂不符合开通收款花呗条件	1
951	借呗一个月可以调整几次额度	借呗限制调整额度	0
952	支付宝的花呗可以淘宝上用吧	淘宝上买东西花呗能用吗	1
953	花呗晚十天还款可以	花呗昨晚维护 不可以还款	0
954	为啥借呗不能分***期了	蚂蚁借呗为什么不能借***期	1
955	另一个账号花呗已经取消了，为什么新的账号还是显示老的账号已经开好	为什么我打开花呗时，会显示建议登录另一个	0
956	为什么有信用度就是开通不了借呗	我的借呗信用跟额度没了	0
957	问下我的支付宝为什么没有借呗	我***个支付宝号 有一个没有借呗 能把另一个转到经常用的号上吗	0
958	为什么无法开通支付宝花呗，和借呗	为什么我能开通是花呗不能开通借呗	0
959	花呗临时额度已经还了，但可用额度还是用不了	我使用的额度，与花呗显示的还款额度不一样	0
960	花呗收款已经开通，顾客这么付款	我已经开通了花呗收款和信用卡收款，但是我不知道怎么收	0
961	我借呗 六个月 可以做一下还款吗	借呗可以前提还那一期的吗	0
962	我花呗逾期了***个月还能恢复是用吗	我花呗逾期了三天，现在全部还清了，蚂蚁借呗多久你恢复	0
963	芝麻信用越高是不是花呗用的也多	花呗开通要多少芝麻信用	0
964	买火车票怎么开通花呗	我用花呗买的火车票退款了为什么还记入记入账单了	0
965	蚂蚁借呗能这个月用下个月还吗	蚂蚁借呗借款***元借六个月 每月还多少	0
966	蚂蚁借呗账户是什么号码	我什么时候才能蚂蚁借呗	0
967	花呗会不会不安全	花呗不安全了	0
968	蚂蚁借呗借了三个月，可以一期全部还清吗	借呗借***个月每个月都还，还是到期一次还清	0
969	借呗每个月用什么还款	为什么现在蚂蚁借呗，还款只有***个月	0
970	今天借呗还款日晚点没事吧	借呗还款晚了***分钟有影响没	0
971	借呗不用会被暂停使用吗	借呗长时间不用会关闭么	0
972	接下来我摩拜单车把押金退了 是用花呗压的	摩拜单车我当时用花呗交的押金 这个款我之前***应该都还完了吧 这退押金又退到花呗里了	0
973	为什么我借呗借的钱还没有到账	借呗钱没到账可以取消吧	0
974	使用花呗已付款，订单显示没有付款	花呗扣款了美团订单显示未付款	1
975	花呗扣钱吗	花呗是到期自动扣款吗	0
976	能取消账户的花呗吗	帮你取消花呗	0
977	花呗已扣款确提示失败	花呗错误扣款	0
978	为什么我不能用花呗付款	我花呗不能充话费了	0
979	只要余额宝有钱，借呗就会自动还款扣费是吗	余额宝上有钱为什么花呗没有自动还款	0
980	蚂蚁花呗得到的优惠券	花呗的优惠券有吗	1
981	花呗什么时候最后还款期限	花呗还款具体时间是什么时候	0
982	花呗输密码给钱	设置花呗交易密码	0
983	花呗临时额度用完了	双十一的时候我花呗额度有临时额度	0
984	花呗***逾期不还一天利息	花呗逾期利息怎么算的	1
985	借呗评估未通过	借呗通过没有	0
986	银行卡扣过了花呗还扣	银行卡支付后 花呗同时扣款	1
987	花呗怎样重新验证	重新申请花呗	0
988	不是的，是退到花呗额度里面，但是花呗的这笔账单也得退掉呀，因为我已经退了，为什么还有这笔账单	为什么我的花呗额度无缘无故掉了一万多	0
989	借呗为什么不能自动还款	蚂蚁借呗自动还款日失败还会自动扣款吗	0
990	我的借呗***号到期还款，可余额宝转不进账怎么办	余额宝无法转入 怎么还借呗	0
991	双十一退款商品使用红包，退款时红包生成花呗账单是什么意思	用了双十一群满返红包的订单 全额退款时花呗账单里红包金额怎么要自己支付的	0
992	用花呗买手机分期了，为什么退款后还收部分费用	我是花呗分期的，退款后扣钱吗	0
993	借呗从哪里进去	蚂蚁借呗借的钱在哪里面	0
994	我之前借呗有***额度提示我可以提升额度我一按我原来的额度也没了	我的借呗申请额度成功了但是借呗页面显示没有信用额度	0
995	使用花呗付款是否需要手续费	用花呗购物需要手续费吗	0
996	借呗银行卡还款怎么限额***	借呗的逾期罚息怎么算	0
997	银行卡和花呗被同时扣款	花呗可以自动扣被锁定了的银行卡里的钱吗	0
998	上次申请借呗失败怎么就不能申请了	怎么我开通不了蚂蚁借呗	0
999	花呗到期没还上	花呗没还款怎么样	1
1000	退款到花呗了，为何还款额没变	为什么花呗退款？ 还款额度还是那么高	0
